{
  "formatVersion": 3,
  "tool": "eventb-animate",
  "toolVersion": "6.4",
  "command": "check",
  "model": "models/traffic-light/M2.bum",
  "machine": "M2",
  "probVersion": "1.15.1-final",
  "timestamp": "2026-07-20T10:00:00Z",
  "durationMs": 842,
  "status": "ok",
  "completion": {
    "classification": "complete",
    "phase": "search",
    "reason": "exhaustive"
  },
  "searchStatistics": {
    "statesDiscovered": 15,
    "statesProcessed": 15,
    "transitions": 34
  },
  "exitCode": 0,
  "message": "No invariant violation or deadlock found (full state space explored).",
  "checks": [
    {
      "name": "invariant",
      "outcome": "passed"
    },
    {
      "name": "deadlock",
      "outcome": "passed"
    }
  ]
}
